{"schema_version":"2.2.0","document_id":"doc_x655ctkrq7d1qhgpprc0y8fbmq","document_version":"ver_4d71960ccd32f56cef2a1e2c6edb82be34e1e7c154b4ba4f61e6dc6d18f0c387","query":"What evidence supports this result?","evidence_units":[{"document_id":"doc_x655ctkrq7d1qhgpprc0y8fbmq","document_version":"ver_4d71960ccd32f56cef2a1e2c6edb82be34e1e7c154b4ba4f61e6dc6d18f0c387","item_type":"text","section_path":["Example section"],"page_index":0,"bounding_box":{"origin":"top-left","units":"points","left":0,"top":0,"right":10,"bottom":10,"page_width":595,"page_height":842},"source_caption":"Example caption","content":"Fixture evidence only.","asset_present":false,"trust_domain":"external_source_untrusted","original_filename":"assay-source.pdf"}]}
